"District","Thana","EIIN","College Name","Shift","Version","Group Name","Gender","Min GPA","Own GPA","Available Seat"
"Nilphamari","Jaldhaka","124947","Chhit Mirganj Shalongram Fazil Madrasah","Day","Bangla","General","Co-Edu","1.00","1.00","140"
"Nilphamari","Jaldhaka","124950","Garh Dharmapal Fazil Madrasah","Day","Bangla","General","Co-Edu","1.00","1.00","60"
"Nilphamari","Jaldhaka","124946","Golmunda Fazil Madrasah","Day","Bangla","General","Co-Edu","1.00","1.00","120"
"Nilphamari","Jaldhaka","124951","Golna Islamia Fazil Madrasah","Day","Bangla","General","Co-Edu","1.00","1.00","80"
"Nilphamari","Jaldhaka","124951","Golna Islamia Fazil Madrasah","Day","Bangla","Science (Madrasha)","Co-Edu","1.00","1.00","40"
"Nilphamari","Jaldhaka","124961","Kazir Hat Panthapara Ideal Alim Madrasah","Day","Bangla","General","Co-Edu","1.00","1.00","70"
"Nilphamari","Jaldhaka","124948","Khutamara Alim Madrasah","Day","Bangla","General","Co-Edu","1.00","1.00","120"
"Nilphamari","Jaldhaka","124956","Koimari Alim Madrasah","Day","Bangla","General","Co-Edu","1.00","1.00","20"
"Nilphamari","Jaldhaka","124944","Pathan Para Madinatul Ulum Alim Madrasah","Day","Bangla","General","Co-Edu","1.00","1.00","100"
"Nilphamari","Jaldhaka","124955","Rajarhat Kabadi Rahmania Alim Madrasah","Day","Bangla","General","Co-Edu","1.00","1.00","80"
"Nilphamari","Kishoreganj","125026","Borovita A. U. Fazil Madrasah","Day","Bangla","General","Co-Edu","1.00","1.00","80"
"Nilphamari","Kishoreganj","125029","Borovita Poshchim Para Hosainia Alim Madrasah","Day","Bangla","General","Co-Edu","1.00","1.00","70"
"Nilphamari","Kishoreganj","125024","Kishorganj Keshba Fazil Madrasah","Day","Bangla","General","Co-Edu","1.00","1.00","40"
"Nilphamari","Kishoreganj","125031","Magura Dola Para Alim Madrasah","Day","Bangla","General","Co-Edu","1.00","1.00","80"
"Nilphamari","Kishoreganj","125042","Panial Pukur Mohabbatia Alim Madrasah","Day","Bangla","General","Co-Edu","1.00","1.00","70"
"Nilphamari","Kishoreganj","125027","Ronochandi Samsul V. Alim Madrasah","Day","Bangla","General","Co-Edu","1.00","1.00","20"
"Nilphamari","Nilphamari Sadar","125164","Chanderhat Alim Madrasah","Day","Bangla","General","Co-Edu","1.00","1.00","40"
"Nilphamari","Nilphamari Sadar","125144","Charchara Bari Darul Ulum Alim Madrasah","Day","Bangla","General","Co-Edu","1.00","1.00","40"
"Nilphamari","Nilphamari Sadar","125152","Dohuli Alim Madrasah","Day","Bangla","General","Co-Edu","1.00","1.00","60"
"Nilphamari","Nilphamari Sadar","125143","Kazirhat Fazil Madrasah","Day","Bangla","General","Co-Edu","1.00","1.00","80"
"Nilphamari","Nilphamari Sadar","125151","Kochukata Majhpara Fazil Madrasah","Day","Bangla","General","Co-Edu","1.00","1.00","70"
"Nilphamari","Nilphamari Sadar","125151","Kochukata Majhpara Fazil Madrasah","Day","Bangla","Science (Madrasha)","Co-Edu","1.00","1.00","20"
"Nilphamari","Nilphamari Sadar","125145","Nilphamari Fazil Madrasah","Day","Bangla","General","Co-Edu","1.00","1.00","290"
"Nilphamari","Nilphamari Sadar","125147","Ponjupukur Alim Madrasah","Day","Bangla","General","Co-Edu","1.00","1.00","60"
"Nilphamari","Nilphamari Sadar","125154","Sangalshi Hazipara Alim Madrasah","Day","Bangla","General","Co-Edu","1.00","1.00","50"
"Nilphamari","Nilphamari Sadar","125154","Sangalshi Hazipara Alim Madrasah","Day","Bangla","Science (Madrasha)","Co-Edu","1.00","1.00","20"
"Nilphamari","Nilphamari Sadar","125142","Tupamari Fazil Madrasah","Day","Bangla","General","Co-Edu","1.00","1.00","80"
"Nilphamari","Nilphamari Sadar","125153","West Chapra Alim Madrasah","Day","Bangla","General","Co-Edu","1.00","1.00","40"
"Nilphamari","Saidpur","125228","Aishdhal Khiarpara Alim Madrasah","Day","Bangla","General","Co-Edu","1.00","1.00","50"
"Nilphamari","Saidpur","125229","Chapra Kashirai Alim Madrasah","Day","Bangla","General","Co-Edu","1.00","1.00","60"
"Nilphamari","Saidpur","125236","Hazarihat Mohammadia Alim Madrasah","Day","Bangla","General","Co-Edu","1.00","1.00","40"
"Nilphamari","Saidpur","125234","Porarhat Si. Alim Madrasah","Day","Bangla","General","Co-Edu","1.00","1.00","60"
"Nilphamari","Saidpur","125231","Sashkandar Alim Madrasah","Day","Bangla","General","Co-Edu","1.00","1.00","60"
"Nilphamari","Saidpur","125227","Sonakhuli Munsipara Kamil Madrasah","Day","Bangla","General","Co-Edu","1.00","1.00","160"
"Nilphamari","Saidpur","125227","Sonakhuli Munsipara Kamil Madrasah","Day","Bangla","Muzzabid","Co-Edu","1.00","1.00","140"
"Nilphamari","Saidpur","125227","Sonakhuli Munsipara Kamil Madrasah","Day","Bangla","Science (Madrasha)","Co-Edu","1.00","1.00","70"
"Noakhali","Begumganj","107244","Baluchara Hasania Alim Madrasah","Day","Bangla","General","Co-Edu","1.00","1.00","40"
"Noakhali","Begumganj","107227","Basantabag Islamia Fazil Madrasah","Day","Bangla","General","Co-Edu","1.00","1.00","140"
"Noakhali","Begumganj","107228","Chandraganj Karamatia Kamil Madrasah","Day","Bangla","General","Co-Edu","1.00","1.00","230"
"Noakhali","Begumganj","107223","Chhayani Imamia Fazil Madrasah","Day","Bangla","General","Co-Edu","1.00","1.00","170"
"Noakhali","Begumganj","107239","Choumuhani Islamia Fazil Madrasah","Day","Bangla","General","Co-Edu","1.00","1.00","140"
"Noakhali","Begumganj","107234","Darul Falah Fazil Madrasah","Day","Bangla","General","Co-Edu","1.00","1.00","60"
"Noakhali","Begumganj","107229","Eaklashpur Islamia Fazil Madrasah","Day","Bangla","General","Co-Edu","1.00","1.00","120"
"Noakhali","Begumganj","107229","Eaklashpur Islamia Fazil Madrasah","Day","Bangla","Science (Madrasha)","Co-Edu","1.00","1.00","70"
"Noakhali","Begumganj","107230","Ghatla Alim Madrasah","Day","Bangla","General","Co-Edu","1.00","1.00","90"
"Noakhali","Begumganj","107225","Joy Narayanpur Islamia Fazil Madrasah","Day","Bangla","General","Co-Edu","1.00","1.00","80"
"Noakhali","Begumganj","107233","Kutubpur Islamia Fazil Madrasah","Day","Bangla","General","Co-Edu","1.00","1.00","130"
"Noakhali","Begumganj","107233","Kutubpur Islamia Fazil Madrasah","Day","Bangla","Science (Madrasha)","Co-Edu","1.00","1.00","110"
"Noakhali","Begumganj","107224","Mir Ahmadpur Fazil Madrasah","Day","Bangla","General","Co-Edu","1.00","1.00","100"
"Noakhali","Begumganj","107226","Mir Warishpur Fazil Madrasah","Day","Bangla","General","Co-Edu","1.00","1.00","220"
"Noakhali","Begumganj","107226","Mir Warishpur Fazil Madrasah","Day","Bangla","Science (Madrasha)","Co-Edu","1.00","1.00","40"
"Noakhali","Begumganj","107242","Nittanandapur Darul Ulum Girls Alim Madrasah","Day","Bangla","General","Female","1.00","1.00","70"
"Noakhali","Begumganj","107245","Paschim Anantapur Islamia Alim Madrasah","Day","Bangla","General","Co-Edu","1.00","1.00","90"
"Noakhali","Begumganj","107231","Rajganj Darul Ul. Fazil Madrasah","Day","Bangla","General","Co-Edu","1.00","1.00","110"
"Noakhali","Chatkhil","107295","Chatkhil Kamil Madrasah","Day","Bangla","General","Co-Edu","1.00","1.00","240"
"Noakhali","Chatkhil","107299","Hirapur Alim Madrasah","Day","Bangla","General","Co-Edu","1.00","1.00","90"
"Noakhali","Chatkhil","107291","Karihati Salemia Fazil Madrasah","Day","Bangla","General","Co-Edu","1.00","1.00","110"
"Noakhali","Chatkhil","107296","Khawazer Bhiti Fazil Madrasah","Day","Bangla","General","Co-Edu","1.00","1.00","100"
"Noakhali","Chatkhil","107289","Mohammodpur Anwar Ali Islamia Fazil Madrasah","Day","Bangla","General","Co-Edu","1.00","1.00","60"
"Noakhali","Chatkhil","107300","Mollikar Dighirpar Fazil Madrasah","Day","Bangla","General","Co-Edu","1.00","1.00","100"
"Noakhali","Chatkhil","107303","Sreeray Mohila Alim Madrasah","Day","Bangla","General","Female","1.00","1.00","50"
"Noakhali","Chatkhil","107292","Taltala Islamia Girls Alim Madrasah","Day","Bangla","General","Female","1.00","1.00","70"
"Noakhali","Companiganj","107346","Bamoni Asiria Alim Madrasah","Day","Bangla","General","Co-Edu","1.00","1.00","90"
"Noakhali","Companiganj","107345","Basurhat Islamia Fazil Madrasah","Day","Bangla","General","Co-Edu","1.00","1.00","300"
"Noakhali","Companiganj","107347","Hazarihat Alim Madrasah","Day","Bangla","General","Co-Edu","1.00","1.00","90"
"Noakhali","Companiganj","107349","Jamia Sharafatia Islamia Fazil Madrasah","Day","Bangla","General","Co-Edu","1.00","1.00","120"
"Noakhali","Companiganj","107344","Rangmala Darus Sunnah Model Alim Madrasah","Day","Bangla","General","Co-Edu","1.00","1.00","50"
"Noakhali","Hatiya","107449","Burir Char Ahmadia Alim Madrasah","Day","Bangla","General","Co-Edu","1.00","1.00","130"
"Noakhali","Hatiya","107450","Char Chenga Islamia Fazil Madrasah","Day","Bangla","General","Co-Edu","1.00","1.00","110"
"Noakhali","Hatiya","107452","Char Kailash Hadia Fazil Madrasah","Day","Bangla","General","Co-Edu","1.00","1.00","80"
"Noakhali","Hatiya","107457","Choumohuni Tobarakia Islamia Alim Madrasah","Day","Bangla","General","Co-Edu","1.00","1.00","110"
"Noakhali","Hatiya","107451","Hatia Darul Ulum Kamil Madrasah","Day","Bangla","General","Co-Edu","1.00","1.00","120"
"Noakhali","Hatiya","107447","Hatiaa Rahmania Fazil Madrasah","Day","Bangla","General","Co-Edu","1.00","1.00","70"
"Noakhali","Hatiya","107447","Hatiaa Rahmania Fazil Madrasah","Day","Bangla","Science (Madrasha)","Co-Edu","1.00","1.00","30"
"Noakhali","Hatiya","107456","Jahajmara Serajul Ul. Alim Madrasah","Day","Bangla","General","Co-Edu","1.00","1.00","150"
"Noakhali","Hatiya","107454","Sukh Char Azharul Ul. Fazil Madrasah","Day","Bangla","General","Co-Edu","1.00","1.00","120"
"Noakhali","Hatiya","107448","Tamaruddin Ahmadia Fazil Madrasah","Day","Bangla","General","Co-Edu","1.00","1.00","130"
"Noakhali","Kabirhat","107612","Chaprashir Hat A. Rob Fazil Madrasah","Day","Bangla","General","Co-Edu","1.00","1.00","150"
"Noakhali","Kabirhat","107612","Chaprashir Hat A. Rob Fazil Madrasah","Day","Bangla","Science (Madrasha)","Co-Edu","1.00","1.00","30"
"Noakhali","Kabirhat","107622","Kabirhat Islamia Alim Madrasah","Day","Bangla","General","Co-Edu","1.00","1.00","150"
"Noakhali","Kabirhat","107607","Sonkhola Alamia Islamia Alim Madrasah","Day","Bangla","General","Co-Edu","1.00","1.00","100"
"Noakhali","Noakhali Sadar","107623","Gorapur Fazil Madrasah","Day","Bangla","General","Co-Edu","1.00","1.00","160"
"Noakhali","Noakhali Sadar","131666","H. A. Janakallyan Alim Madrasah","Day","Bangla","General","Co-Edu","1.00","1.00","150"
"Noakhali","Noakhali Sadar","107614","Khalifar Hat Hamidia Fazil Madrasah","Day","Bangla","General","Co-Edu","1.00","1.00","160"
"Noakhali","Noakhali Sadar","107615","Kripalpur Islamia Alim Madrasah","Day","Bangla","General","Co-Edu","1.00","1.00","100"
"Noakhali","Noakhali Sadar","107619","Noakhali Islamia Kamil Madrasah","Day","Bangla","General","Co-Edu","1.00","1.00","330"
"Noakhali","Noakhali Sadar","107619","Noakhali Islamia Kamil Madrasah","Day","Bangla","Muzzabid","Co-Edu","1.00","1.00","40"
"Noakhali","Noakhali Sadar","107618","Noakhali Karamatia Kamil Madrasah","Day","Bangla","General","Co-Edu","1.00","1.00","480"
"Noakhali","Noakhali Sadar","107649","Sayedul Abrar Mohila Alim Madrasah","Day","Bangla","General","Female","1.00","1.00","70"
"Noakhali","Senbagh","107504","Bijbag Rabbania Alim Madrasah","Day","Bangla","General","Co-Edu","1.00","1.00","90"
"Noakhali","Senbagh","107513","Chachua Hazi Ali Akbar Alim Madrasah","Day","Bangla","General","Co-Edu","1.00","1.00","70"
"Noakhali","Senbagh","107508","Enayetpur Rahmatia Alim Madrasah","Day","Bangla","General","Co-Edu","1.00","1.00","100"
"Noakhali","Senbagh","131640","Eshfaqul Haque Manna Alim Madrasah","Day","Bangla","General","Co-Edu","1.00","1.00","90"
"Noakhali","Senbagh","107497","Joynagar Wajedia Alim Madrasah","Day","Bangla","General","Co-Edu","1.00","1.00","80"
"Noakhali","Senbagh","107505","Kankirhat Fazil Madrasah","Day","Bangla","General","Co-Edu","1.00","1.00","90"
"Noakhali","Senbagh","107506","Motulibur Hamul Ul. Alim Madrasah","Day","Bangla","General","Co-Edu","1.00","1.00","60"
"Noakhali","Senbagh","107509","Razarampur Bashiria Alim Madrasah","Day","Bangla","General","Co-Edu","1.00","1.00","110"
"Noakhali","Senbagh","107499","Senbag Fazil Madrasah","Day","Bangla","General","Co-Edu","1.00","1.00","260"
"Noakhali","Sonaimuri","107405","Abdullah Hat Fazil Madrasah","Day","Bangla","General","Co-Edu","1.00","1.00","80"
"Noakhali","Sonaimuri","107411","Amki Mahila Alim Madrasah","Day","Bangla","General","Female","1.00","1.00","60"
"Noakhali","Sonaimuri","107406","Hossainpur Darussunnah Islamia Alim Madrasah","Day","Bangla","General","Co-Edu","1.00","1.00","50"
"Noakhali","Sonaimuri","107397","Joyag Rashidia Alim Madrasah","Day","Bangla","General","Co-Edu","1.00","1.00","60"
"Noakhali","Sonaimuri","107395","Kashipur Mohammadia Fazil Madrasah","Day","Bangla","General","Co-Edu","1.00","1.00","160"
"Noakhali","Sonaimuri","107398","Khalilur Rahman Kamil Madrasah","Day","Bangla","General","Co-Edu","1.00","1.00","170"
"Noakhali","Sonaimuri","107398","Khalilur Rahman Kamil Madrasah","Day","Bangla","Science (Madrasha)","Co-Edu","1.00","1.00","30"
"Noakhali","Sonaimuri","107403","Nandiapara Ashraful Ul. Alim Madrasah","Day","Bangla","General","Co-Edu","1.00","1.00","90"
"Noakhali","Sonaimuri","107401","Padipara Senior Alim Madrasah","Day","Bangla","General","Co-Edu","1.00","1.00","70"
"Noakhali","Sonaimuri","107407","Saktala Si. Islamia Alim Madrasah","Day","Bangla","General","Co-Edu","1.00","1.00","70"
"Noakhali","Sonaimuri","107394","Sonaimuri Hamidia Kamil Madrasah","Day","Bangla","General","Co-Edu","1.00","1.00","220"
"Noakhali","Sonaimuri","107394","Sonaimuri Hamidia Kamil Madrasah","Day","Bangla","Science (Madrasha)","Co-Edu","1.00","1.00","30"
"Noakhali","Sonaimuri","107399","Thanarhat Alim Madrasah","Day","Bangla","General","Co-Edu","1.00","1.00","50"
"Noakhali","Subarnachar","107625","Char Bata Ismailia Alim Madrasah","Day","Bangla","General","Co-Edu","1.00","1.00","130"
"Noakhali","Subarnachar","107624","Char Jubli Robbania Fazil Madrasah","Day","Bangla","General","Co-Edu","1.00","1.00","390"
"Pabna","Atgharia","125280","Chandbha  Islamia Alim Madrasah","Day","Bangla","Science (Madrasha)","Co-Edu","1.00","1.00","40"
"Pabna","Atgharia","125280","Chandbha  Islamia Alim Madrasah","Day","Bangla","General","Co-Edu","1.00","1.00","110"
"Pabna","Atgharia","125279","Mazpara Alim Madrasah","Day","Bangla","General","Co-Edu","1.00","1.00","50"
"Pabna","Atgharia","125282","Taha Islamia Fazil Madrasah","Day","Bangla","General","Co-Edu","1.00","1.00","120"
"Pabna","Atgharia","125282","Taha Islamia Fazil Madrasah","Day","Bangla","Science (Madrasha)","Co-Edu","1.00","1.00","60"
"Pabna","Bera","125321","Bera Alim Madrasah","Day","Bangla","General","Co-Edu","1.00","1.00","70"
"Pabna","Bera","125321","Bera Alim Madrasah","Day","Bangla","Science (Madrasha)","Co-Edu","1.00","1.00","30"
"Pabna","Bera","125326","Bera Mohila Alim Madrasah","Day","Bangla","General","Female","1.00","1.00","80"
"Pabna","Bera","125326","Bera Mohila Alim Madrasah","Day","Bangla","Science (Madrasha)","Female","1.00","1.00","20"
"Pabna","Bhangura","125363","C. K. B. Rostasia Alim Madrasah","Day","Bangla","General","Co-Edu","1.00","1.00","60"
"Pabna","Bhangura","125354","Hajee Goejuddin Mohila Fazil Madrasah","Day","Bangla","General","Female","1.00","1.00","50"
"Pabna","Bhangura","125361","Kairasara Nasir Alim Madrasah","Day","Bangla","General","Co-Edu","1.00","1.00","60"
"Pabna","Bhangura","125353","Sharatnagar Fazil Madrasah","Day","Bangla","General","Co-Edu","1.00","1.00","100"
"Pabna","Chatmohar","125414","Chatmohar Enayet Ullah Islamia Fazil Madrasah","Day","Bangla","General","Co-Edu","1.00","1.00","70"
"Pabna","Chatmohar","125414","Chatmohar Enayet Ullah Islamia Fazil Madrasah","Day","Bangla","Science (Madrasha)","Co-Edu","1.00","1.00","40"
"Pabna","Chatmohar","125418","Haripur Masjid Para Siddikia Alim Madrasah","Day","Bangla","Science (Madrasha)","Co-Edu","1.00","1.00","30"
"Pabna","Chatmohar","125418","Haripur Masjid Para Siddikia Alim Madrasah","Day","Bangla","General","Co-Edu","1.00","1.00","70"
"Pabna","Chatmohar","125415","Hogolbaria Alim Madrasah","Day","Bangla","General","Co-Edu","1.00","1.00","40"
"Pabna","Chatmohar","125423","Pakpara Shah Mokhlesur Rahman Alim Madrasah","Day","Bangla","General","Co-Edu","1.00","1.00","50"
"Pabna","Chatmohar","125424","Ramchandrapur Alim Madrasah","Day","Bangla","General","Co-Edu","1.00","1.00","80"
"Pabna","Faridpur","125479","Bonwarinagar Alim Madrasah","Day","Bangla","General","Co-Edu","1.00","1.00","50"
"Pabna","Faridpur","125479","Bonwarinagar Alim Madrasah","Day","Bangla","Science (Madrasha)","Co-Edu","1.00","1.00","40"
"Pabna","Faridpur","125478","Dighuli Alim Madrasah","Day","Bangla","General","Co-Edu","1.00","1.00","60"
"Pabna","Faridpur","125477","Hadal Fazil Madrasah","Day","Bangla","General","Co-Edu","1.00","1.00","80"
"Pabna","Faridpur","125474","Mongalgram Ahmadia Alim Madrasah","Day","Bangla","General","Co-Edu","1.00","1.00","50"
"Pabna","Ishwardi","125539","Autapara A. B. C. Alim Madrasah","Day","Bangla","General","Co-Edu","1.00","1.00","90"
"Pabna","Ishwardi","125548","Dasuria Madinatul Ulum Alim Madrasah","Day","Bangla","General","Co-Edu","1.00","1.00","40"
"Pabna","Ishwardi","125540","Iswardi Islamia Alim Madrasah","Day","Bangla","General","Co-Edu","1.00","1.00","80"
"Pabna","Ishwardi","125542","Mirkamari Ideal Alim Madrasah","Day","Bangla","General","Co-Edu","1.00","1.00","30"
"Pabna","Ishwardi","125541","Mojidia Babul Ul. Islamia Fazil Madrasah","Day","Bangla","General","Co-Edu","1.00","1.00","70"
"Pabna","Ishwardi","125543","Muladuli D. U. Sinior Madrasah","Day","Bangla","General","Co-Edu","1.00","1.00","60"
"Pabna","Pabna Sadar","125620","Arifpur Jameul Ul. Fazil Madrasah","Day","Bangla","General","Co-Edu","1.00","1.00","170"
"Pabna","Pabna Sadar","125619","Ataikula Saradangi Alim Madrasah","Day","Bangla","Science (Madrasha)","Co-Edu","1.00","1.00","50"
"Pabna","Pabna Sadar","125619","Ataikula Saradangi Alim Madrasah","Day","Bangla","General","Co-Edu","1.00","1.00","150"
"Pabna","Pabna Sadar","125637","Hahi Engineer Abul Kashem Mohila Alim Madrasah","Day","Bangla","General","Female","1.00","1.00","40"
"Pabna","Pabna Sadar","125623","Mahmudpur Islamia Alim Madrasah","Day","Bangla","General","Co-Edu","1.00","1.00","70"
"Pabna","Pabna Sadar","125617","Modhupur Women Alim Madrasah","Day","Bangla","General","Female","1.00","1.00","40"
"Pabna","Pabna Sadar","125628","Nandanpur Alhaz Ibrahimia Alim Madrasah","Day","Bangla","General","Co-Edu","1.00","1.00","50"
"Pabna","Pabna Sadar","125618","Pabna Islamia Alim Madrasah","Day","Bangla","Science (Madrasha)","Co-Edu","1.00","1.00","70"
"Pabna","Pabna Sadar","125618","Pabna Islamia Alim Madrasah","Day","Bangla","General","Co-Edu","1.00","1.00","240"
"Pabna","Pabna Sadar","125647","Pabna Kamil Madrasah","Day","Bangla","Muzzabid","Co-Edu","1.00","1.00","60"
"Pabna","Pabna Sadar","125647","Pabna Kamil Madrasah","Day","Bangla","General","Co-Edu","1.00","1.00","210"
"Pabna","Pabna Sadar","125647","Pabna Kamil Madrasah","Day","Bangla","Science (Madrasha)","Co-Edu","1.00","1.00","110"
"Pabna","Pabna Sadar","125622","Pushpapara Kamil Madrasah","Day","Bangla","Science (Madrasha)","Co-Edu","1.00","1.00","30"
"Pabna","Pabna Sadar","125622","Pushpapara Kamil Madrasah","Day","Bangla","General","Co-Edu","1.00","1.00","130"
"Pabna","Pabna Sadar","125621","Tarabaria Abu Bakar Siddiquia Alim Madrasah","Day","Bangla","General","Co-Edu","1.00","1.00","130"
"Pabna","Santhia","125722","Boailmari Kamil Madrasah","Day","Bangla","General","Co-Edu","1.00","1.00","90"
"Pabna","Santhia","125722","Boailmari Kamil Madrasah","Day","Bangla","Science (Madrasha)","Co-Edu","1.00","1.00","70"
"Pabna","Santhia","125715","Dhulari Kawsaria Kamil Madrasah","Day","Bangla","Science (Madrasha)","Co-Edu","1.00","1.00","50"
"Pabna","Santhia","125715","Dhulari Kawsaria Kamil Madrasah","Day","Bangla","General","Co-Edu","1.00","1.00","80"
"Pabna","Santhia","125727","Edrakpur K. A. Alim Madrasah","Day","Bangla","General","Co-Edu","1.00","1.00","30"
"Pabna","Santhia","125723","Gourigram Fatehia Alim Madrasah","Day","Bangla","General","Co-Edu","1.00","1.00","70"
"Pabna","Santhia","125736","M. C. K. Alim Madrasah","Day","Bangla","General","Co-Edu","1.00","1.00","40"
"Pabna","Santhia","125718","Shilonda Islamia Alim Madrasah","Day","Bangla","General","Co-Edu","1.00","1.00","70"
"Pabna","Sujanagar","125780","Ulat Si. Fazil Madrasah","Day","Bangla","General","Co-Edu","1.00","1.00","70"
"Panchagarh","Atwari","125850","Laxmipur Islamia  Alim Madrasah","Day","Bangla","Science (Madrasha)","Co-Edu","1.00","1.00","20"
"Panchagarh","Atwari","125850","Laxmipur Islamia  Alim Madrasah","Day","Bangla","General","Co-Edu","1.00","1.00","110"
"Panchagarh","Atwari","125858","Mirzapur Maulana Azim Uddin Alim Madrasah","Day","Bangla","General","Co-Edu","1.00","1.00","80"
"Panchagarh","Atwari","125852","Satkhamar Islamia Fazil Madrasah","Day","Bangla","General","Co-Edu","1.00","1.00","150"
"Panchagarh","Boda","125953","Manikpir Benghari Fazil Madrasah","Day","Bangla","General","Co-Edu","1.00","1.00","70"
"Panchagarh","Boda","125959","Sankoa Jamilatun Nesa Alim Madrasah","Day","Bangla","General","Co-Edu","1.00","1.00","150"
"Panchagarh","Boda","125959","Sankoa Jamilatun Nesa Alim Madrasah","Day","Bangla","Science (Madrasha)","Co-Edu","1.00","1.00","50"
"Panchagarh","Boda","125956","Shal Shiri Ekramia Alim Madrasah","Day","Bangla","General","Co-Edu","1.00","1.00","60"
"Panchagarh","Debiganj","126034","Vaulaganj Darus Salam Nesaria Alim Madrasah","Day","Bangla","General","Co-Edu","1.00","1.00","70"
"Panchagarh","Panchagarh Sadar","138189","BANGOBONDHU SHEIKH MOJIBUR RAHMAN ALIM MADRASAH","Day","Bangla","General","Co-Edu","1.00","1.00","120"
"Panchagarh","Panchagarh Sadar","138189","BANGOBONDHU SHEIKH MOJIBUR RAHMAN ALIM MADRASAH","Day","Bangla","Science (Madrasha)","Co-Edu","1.00","1.00","40"
"Panchagarh","Panchagarh Sadar","126129","Duipara Alim Madrasah","Day","Bangla","General","Co-Edu","1.00","1.00","130"
"Panchagarh","Panchagarh Sadar","126126","Golaha Hat Alim Madrasah","Day","Bangla","General","Co-Edu","1.00","1.00","60"
"Panchagarh","Panchagarh Sadar","126139","Hazi Khamir Uddin Pradhan Alim Madrasah","Day","Bangla","General","Co-Edu","1.00","1.00","100"
"Panchagarh","Panchagarh Sadar","126130","Khanbahadur Mokhlesur Rahman Darusunnat Alim Madrasah","Day","Bangla","General","Co-Edu","1.00","1.00","50"
"Panchagarh","Panchagarh Sadar","126140","Panchagarh Adarsha Mohila Alim Madrasah","Day","Bangla","General","Female","1.00","1.00","50"
"Panchagarh","Panchagarh Sadar","126124","Panchagarh Nurun Ala Nur Kamil Madrasah","Day","Bangla","General","Co-Edu","1.00","1.00","210"
"Panchagarh","Panchagarh Sadar","126124","Panchagarh Nurun Ala Nur Kamil Madrasah","Day","Bangla","Muzzabid","Co-Edu","1.00","1.00","30"
"Panchagarh","Panchagarh Sadar","126124","Panchagarh Nurun Ala Nur Kamil Madrasah","Day","Bangla","Science (Madrasha)","Co-Edu","1.00","1.00","90"
"Panchagarh","Tentulia","126182","Begum Fokhrunnesa Alim Madrasah","Day","Bangla","Science (Madrasha)","Co-Edu","1.00","1.00","50"
"Panchagarh","Tentulia","126182","Begum Fokhrunnesa Alim Madrasah","Day","Bangla","General","Co-Edu","1.00","1.00","100"
"Panchagarh","Tentulia","126181","Kalandiganj Fazil Madrasah","Day","Bangla","General","Co-Edu","1.00","1.00","110"
"Patuakhali","Bauphal","102051","Basarbad (Chabua) Salehia Alim Madrasah","Day","Bangla","General","Co-Edu","1.00","1.00","50"
"Patuakhali","Bauphal","102038","Baufal Salehia Fazil Madrasah","Day","Bangla","General","Co-Edu","1.00","1.00","180"
"Patuakhali","Bauphal","102040","Baze Mahal Obayedia Fazil Madrasah","Day","Bangla","General","Co-Edu","1.00","1.00","100"
"Patuakhali","Bauphal","102039","Bilbilash Nesaria Fazil Madrasah","Day","Bangla","General","Co-Edu","1.00","1.00","100"
"Patuakhali","Bauphal","102098","Chandpara Dhali Asia Khatun Alim Madrasah","Day","Bangla","General","Co-Edu","1.00","1.00","100"
"Patuakhali","Bauphal","102054","Dhandi Fazil Madrasah","Day","Bangla","General","Co-Edu","1.00","1.00","200"
"Patuakhali","Bauphal","102054","Dhandi Fazil Madrasah","Day","Bangla","Science (Madrasha)","Co-Edu","0.00","0.00","50"
"Patuakhali","Bauphal","102044","Gulbag Alim Madrasah","Day","Bangla","General","Co-Edu","1.00","1.00","90"
"Patuakhali","Bauphal","102077","Indrokul Akbaria Alim Madrasah","Day","Bangla","General","Co-Edu","1.00","1.00","70"
"Patuakhali","Bauphal","102041","Kalaiya Rabbania Fazil Madrasah","Day","Bangla","General","Co-Edu","1.00","1.00","290"
"Patuakhali","Bauphal","102048","Karkhana Darul Islamia Alim Madrasah","Day","Bangla","General","Co-Edu","1.00","1.00","90"
"Patuakhali","Bauphal","102091","Keshobpur Fazlul Hoq Alim Madrasah","Day","Bangla","General","Co-Edu","1.00","1.00","230"
"Patuakhali","Bauphal","102046","Mohsenuddin Nuria Fazil Madrasah","Day","Bangla","General","Co-Edu","1.00","1.00","70"
"Patuakhali","Bauphal","102042","Nuruainpur Fazil Madrasah","Day","Bangla","General","Co-Edu","1.00","1.00","170"
"Patuakhali","Bauphal","102052","Paschim Noumala Alim Madrasah","Day","Bangla","General","Co-Edu","1.00","1.00","170"
"Patuakhali","Bauphal","102047","Ponahura Nesaria Alim Madrasah","Day","Bangla","General","Co-Edu","1.00","1.00","210"
"Patuakhali","Bauphal","102047","Ponahura Nesaria Alim Madrasah","Day","Bangla","Science (Madrasha)","Co-Edu","1.00","1.00","50"
"Patuakhali","Bauphal","102079","Purba Adabaria Dr. Alim Madrasah","Day","Bangla","General","Co-Edu","1.00","1.00","80"
"Patuakhali","Bauphal","102043","Uttor Konokdia Alim Madrasah","Day","Bangla","General","Co-Edu","1.00","1.00","70"
"Patuakhali","Dashmina","102146","Adampura Fazil Madrasah","Day","Bangla","General","Co-Edu","1.00","1.00","240"
"Patuakhali","Dashmina","102144","Char Hosnabad Alim Madrasah","Day","Bangla","General","Co-Edu","1.00","1.00","160"
"Patuakhali","Dashmina","102150","Dasmina Islamia Fazil Madrasah","Day","Bangla","General","Co-Edu","1.00","1.00","280"
"Patuakhali","Dashmina","102149","Purbachandpur Salehia Alim Madrasah","Day","Bangla","General","Co-Edu","1.00","1.00","20"
