"District","Thana","EIIN","College Name","Shift","Version","Group Name","Gender","Min GPA","Own GPA","Available Seat"
"Joypurhat","Joypurhat Sadar","121858","Hanail Nomania Kamil Madrasah","Day","Bangla","Science (Madrasha)","Co-Edu","1.00","1.00","50"
"Joypurhat","Joypurhat Sadar","121855","Joipurhat Siddiquia Kamil Madrasah","Day","Bangla","Muzzabid","Co-Edu","1.00","1.00","20"
"Joypurhat","Joypurhat Sadar","121855","Joipurhat Siddiquia Kamil Madrasah","Day","Bangla","General","Co-Edu","1.00","1.00","310"
"Joypurhat","Joypurhat Sadar","121855","Joipurhat Siddiquia Kamil Madrasah","Day","Bangla","Science (Madrasha)","Co-Edu","1.00","1.00","240"
"Joypurhat","Joypurhat Sadar","121853","Karai Nurul Huda Kamil Madrasah","Day","Bangla","Science (Madrasha)","Co-Edu","1.00","1.00","50"
"Joypurhat","Joypurhat Sadar","121853","Karai Nurul Huda Kamil Madrasah","Day","Bangla","General","Co-Edu","1.00","1.00","150"
"Joypurhat","Joypurhat Sadar","121879","Mahrul Alim Madrasah","Day","Bangla","General","Co-Edu","1.00","1.00","20"
"Joypurhat","Joypurhat Sadar","121860","Nengapirhat S. A. Si. Fazil Madrasah","Day","Bangla","General","Co-Edu","1.00","1.00","60"
"Joypurhat","Joypurhat Sadar","121860","Nengapirhat S. A. Si. Fazil Madrasah","Day","Bangla","Science (Madrasha)","Co-Edu","1.00","1.00","50"
"Joypurhat","Joypurhat Sadar","121862","Sahapur Shahidia Alim Madrasah","Day","Bangla","General","Co-Edu","1.00","1.00","20"
"Joypurhat","Joypurhat Sadar","121862","Sahapur Shahidia Alim Madrasah","Day","Bangla","Science (Madrasha)","Co-Edu","1.00","1.00","20"
"Joypurhat","Joypurhat Sadar","121880","Uri Madhabpara Girls Alim Madrasah","Day","Bangla","General","Female","1.00","1.00","50"
"Joypurhat","Kalai","121921","Bagungram Chasma -E- Ulum Fazil Madrasah","Day","Bangla","General","Co-Edu","1.00","1.00","80"
"Joypurhat","Kalai","121924","Bahuti Gulzarul Ul. Alim Madrasah","Day","Bangla","General","Co-Edu","1.00","1.00","80"
"Joypurhat","Kalai","121923","Hatior Bahumukhi Fazil Madrasah","Day","Bangla","General","Co-Edu","1.00","1.00","130"
"Joypurhat","Kalai","121923","Hatior Bahumukhi Fazil Madrasah","Day","Bangla","Science (Madrasha)","Co-Edu","1.00","1.00","50"
"Joypurhat","Kalai","121936","Kadirpur Alim Madrasah","Day","Bangla","General","Co-Edu","1.00","1.00","50"
"Joypurhat","Kalai","121936","Kadirpur Alim Madrasah","Day","Bangla","Science (Madrasha)","Co-Edu","1.00","1.00","20"
"Joypurhat","Kalai","121922","Pur M. U. Fazil Madrasah","Day","Bangla","General","Co-Edu","1.00","1.00","80"
"Joypurhat","Khetlal","121970","Bot Tali Fatema Zahura Mohila Fazil Madrasah","Day","Bangla","General","Female","1.00","1.00","40"
"Joypurhat","Khetlal","121970","Bot Tali Fatema Zahura Mohila Fazil Madrasah","Day","Bangla","Science (Madrasha)","Female","1.00","1.00","40"
"Joypurhat","Khetlal","121974","Burail D. S. Fazil Madrasah","Day","Bangla","General","Co-Edu","1.00","1.00","20"
"Joypurhat","Khetlal","121974","Burail D. S. Fazil Madrasah","Day","Bangla","Muzzabid","Co-Edu","1.00","1.00","20"
"Joypurhat","Khetlal","121974","Burail D. S. Fazil Madrasah","Day","Bangla","Science (Madrasha)","Co-Edu","1.00","1.00","40"
"Joypurhat","Khetlal","121971","Fuldighihat Chasma-E-Ul Fazil Madrasah","Day","Bangla","General","Co-Edu","1.00","1.00","60"
"Joypurhat","Khetlal","121969","Jaamuhali Se. Alim Madrasah","Day","Bangla","Science (Madrasha)","Co-Edu","1.00","1.00","60"
"Joypurhat","Khetlal","121969","Jaamuhali Se. Alim Madrasah","Day","Bangla","General","Co-Edu","1.00","1.00","20"
"Joypurhat","Khetlal","121968","Khetlal Khoshbadan Golgar-E-Ulum Alim Madrasah","Day","Bangla","General","Co-Edu","1.00","1.00","60"
"Joypurhat","Khetlal","121968","Khetlal Khoshbadan Golgar-E-Ulum Alim Madrasah","Day","Bangla","Science (Madrasha)","Co-Edu","1.00","1.00","60"
"Joypurhat","Khetlal","121977","Shibpur Nomania Alim Madrasah","Day","Bangla","General","Co-Edu","1.00","1.00","50"
"Joypurhat","Panchbibi","122038","Banshkhur Fazil Madrasah","Day","Bangla","General","Co-Edu","1.00","1.00","60"
"Joypurhat","Panchbibi","122038","Banshkhur Fazil Madrasah","Day","Bangla","Science (Madrasha)","Co-Edu","1.00","1.00","50"
"Joypurhat","Panchbibi","122049","Fatepur Chatkhur Alim Madrasah","Day","Bangla","General","Co-Edu","1.00","1.00","80"
"Joypurhat","Panchbibi","122036","Karia Islamia Alim Madrasah","Day","Bangla","General","Co-Edu","1.00","1.00","70"
"Joypurhat","Panchbibi","122036","Karia Islamia Alim Madrasah","Day","Bangla","Science (Madrasha)","Co-Edu","1.00","1.00","90"
"Joypurhat","Panchbibi","122039","Mahabbatpur Aminia Fazil Madrasah","Day","Bangla","General","Co-Edu","1.00","1.00","60"
"Joypurhat","Panchbibi","122039","Mahabbatpur Aminia Fazil Madrasah","Day","Bangla","Science (Madrasha)","Co-Edu","1.00","1.00","50"
"Joypurhat","Panchbibi","122054","Panchbibi Balighata Alim Madrasah","Day","Bangla","General","Co-Edu","1.00","1.00","40"
"Joypurhat","Panchbibi","122057","Shiratti Mostafabia Senior Alim Madrasah.","Day","Bangla","General","Co-Edu","1.00","1.00","70"
"Joypurhat","Panchbibi","122057","Shiratti Mostafabia Senior Alim Madrasah.","Day","Bangla","Science (Madrasha)","Co-Edu","1.00","1.00","40"
"Khagrachhari","Khagrachhari Sadar","106787","Khagrachhari Islamia Alim Madrasah","Day","Bangla","General","Co-Edu","1.00","1.00","70"
"Khagrachhari","Khagrachhari Sadar","106787","Khagrachhari Islamia Alim Madrasah","Day","Bangla","Muzzabid","Co-Edu","1.00","1.00","20"
"Khagrachhari","Matiranga","106834","Matiranga Islamia Alim Madrasah","Day","Bangla","General","Co-Edu","1.00","1.00","60"
"Khagrachhari","Matiranga","106833","Tabalchhari Islamia Alim Madrasah","Day","Bangla","General","Co-Edu","1.00","1.00","80"
"Khagrachhari","Matiranga","106832","Taindang Mohammadia Alim Madrasah","Day","Bangla","General","Co-Edu","1.00","1.00","20"
"Khagrachhari","Panchhari","106845","Panchhari Islamia Si. Alim Madrasah","Day","Bangla","General","Co-Edu","1.00","1.00","40"
"Khagrachhari","Ramgarh","106856","Ramgarh Ganiatul Ul. Alim Madrasah","Day","Bangla","General","Co-Edu","1.00","1.00","200"
"Khulna","Batiaghata","116858","Fulbari Alim Madrasah","Day","Bangla","General","Co-Edu","1.00","1.00","90"
"Khulna","Dacope","116917","Chalna Billalia Alim Madrasah","Day","Bangla","General","Co-Edu","1.00","1.00","80"
"Khulna","Dacope","116918","Nalian Alim Madrasah","Day","Bangla","General","Co-Edu","1.00","1.00","40"
"Khulna","Daulatpur","116949","Daulatpur Alim Madrasah","Day","Bangla","General","Co-Edu","1.00","1.00","40"
"Khulna","Daulatpur","116949","Daulatpur Alim Madrasah","Day","Bangla","Science (Madrasha)","Co-Edu","1.00","1.00","20"
"Khulna","Daulatpur","117125","Mirer Danga Islamia Alim Madrasah","Day","Bangla","Science (Madrasha)","Co-Edu","1.00","1.00","40"
"Khulna","Daulatpur","117125","Mirer Danga Islamia Alim Madrasah","Day","Bangla","General","Co-Edu","1.00","1.00","90"
"Khulna","Dighalia","117078","Hasania Alim Madrasah","Day","Bangla","General","Co-Edu","1.00","1.00","20"
"Khulna","Dumuria","117023","Dumuria Mojidia Islamia Alim Madrasah","Day","Bangla","General","Co-Edu","1.00","1.00","110"
"Khulna","Dumuria","117029","Madhugram Islamia Alim Madrasah","Day","Bangla","General","Co-Edu","1.00","1.00","110"
"Khulna","Dumuria","117026","Nurania Islamia Fazil Madrasah","Day","Bangla","General","Co-Edu","1.00","1.00","110"
"Khulna","Khalishpur","117106","Cresent Alim Madrasah","Day","Bangla","General","Co-Edu","1.00","1.00","50"
"Khulna","Khulna Sadar","117349","Fultola Ahmadia Alim Madrasah","Day","Bangla","General","Co-Edu","1.00","1.00","110"
"Khulna","Khulna Sadar","117159","Khan  A Sobur WomenS Fazil Madrasah","Day","Bangla","General","Co-Edu","1.00","1.00","110"
"Khulna","Khulna Sadar","117159","Khan  A Sobur WomenS Fazil Madrasah","Day","Bangla","Science (Madrasha)","Co-Edu","1.00","1.00","60"
"Khulna","Khulna Sadar","117162","Khulna Kamil Madrasah","Day","Bangla","General","Co-Edu","1.00","1.00","300"
"Khulna","Khulna Sadar","117162","Khulna Kamil Madrasah","Day","Bangla","Science (Madrasha)","Co-Edu","1.00","1.00","70"
"Khulna","Khulna Sadar","117105","Khulna Nesaria Kamil Madrasah","Day","Bangla","General","Co-Edu","1.00","1.00","110"
"Khulna","Khulna Sadar","117105","Khulna Nesaria Kamil Madrasah","Day","Bangla","Science (Madrasha)","Co-Edu","1.00","1.00","40"
"Khulna","Koyra","117221","Be. Sin. Mim. Bailaharania Alim Madrasah","Day","Bangla","General","Co-Edu","1.00","1.00","80"
"Khulna","Koyra","117215","D. F. Naksha Alim Madrasah","Day","Bangla","General","Co-Edu","1.00","1.00","100"
"Khulna","Koyra","117214","Ghugrakathi Ahammadia Fazil Madrasah","Day","Bangla","General","Co-Edu","1.00","1.00","130"
"Khulna","Koyra","117213","Kalna Aminia Fazil Madrasah","Day","Bangla","General","Co-Edu","1.00","1.00","270"
"Khulna","Koyra","117212","Koyra Siddikia Fazil Madrasah","Day","Bangla","General","Co-Edu","1.00","1.00","170"
"Khulna","Koyra","117211","Koyra Uttar Chalk Aminia Kamil Madrasah","Day","Bangla","Science (Madrasha)","Co-Edu","1.00","1.00","30"
"Khulna","Koyra","117211","Koyra Uttar Chalk Aminia Kamil Madrasah","Day","Bangla","General","Co-Edu","1.00","1.00","145"
"Khulna","Koyra","117222","Kushodanga Alhaz Komor Uddin Alim Madrasah","Day","Bangla","General","Co-Edu","1.00","1.00","110"
"Khulna","Paikgachha","117303","Alamtala Islamia Azizia Fazil Madrasah","Day","Bangla","General","Co-Edu","1.00","1.00","60"
"Khulna","Paikgachha","117306","Gojalia Kalua Alim Madrasah","Day","Bangla","General","Co-Edu","1.00","1.00","70"
"Khulna","Paikgachha","117297","Habibnagar M. K. D. Fazil Madrasah","Day","Bangla","General","Co-Edu","1.00","1.00","70"
"Khulna","Paikgachha","117299","Kapilmuni Zaffar Aulia Fazil Madrasah","Day","Bangla","General","Co-Edu","1.00","1.00","100"
"Khulna","Paikgachha","117308","Paikgachha Alim Madrasah","Day","Bangla","General","Co-Edu","1.00","1.00","80"
"Khulna","Paikgachha","117300","Patrabunia Alim Madrasah","Day","Bangla","General","Co-Edu","1.00","1.00","30"
"Khulna","Paikgachha","117304","Raruli Alim Madrasah","Day","Bangla","General","Co-Edu","1.00","1.00","50"
"Khulna","Phultala","117350","Jamira Bazar Piprail Fazil Madrasah","Day","Bangla","General","Co-Edu","1.00","1.00","70"
"Khulna","Phultala","117127","Shirmani Alim Madrasah","Day","Bangla","General","Co-Edu","1.00","1.00","50"
"Khulna","Phultala","117127","Shirmani Alim Madrasah","Day","Bangla","Science (Madrasha)","Co-Edu","1.00","1.00","20"
"Khulna","Rupsa","117382","Deyara Jugihati Alim Madrasah","Day","Bangla","General","Co-Edu","1.00","1.00","60"
"Khulna","Rupsa","117386","Rupsha Darussunnat Alim Madrasah","Day","Bangla","General","Co-Edu","1.00","1.00","40"
"Khulna","Sonadanga","117421","Darul Quran Siddikia Kamil Madrasah","Day","Bangla","General","Co-Edu","1.00","1.00","200"
"Khulna","Sonadanga","117421","Darul Quran Siddikia Kamil Madrasah","Day","Bangla","Science (Madrasha)","Co-Edu","1.00","1.00","70"
"Khulna","Sonadanga","117423","Muhammadnagar WomenS Kamil Madrasah","Day","Bangla","Science (Madrasha)","Female","1.00","1.00","60"
"Khulna","Sonadanga","117423","Muhammadnagar WomenS Kamil Madrasah","Day","Bangla","General","Female","1.00","1.00","110"
"Khulna","Sonadanga","117422","Talimul Millat Rah.Fazil Madrasah","Day","Bangla","General","Co-Edu","1.00","1.00","160"
"Khulna","Sonadanga","117422","Talimul Millat Rah.Fazil Madrasah","Day","Bangla","Science (Madrasha)","Co-Edu","1.00","0.00","20"
"Khulna","Terokhada","117453","Atlia Si. Alim Madrasah","Day","Bangla","General","Co-Edu","1.00","1.00","80"
"Kishoreganj","Austagram","110235","Astagram Hossainia Alim Madrasah","Day","Bangla","General","Co-Edu","1.00","1.00","70"
"Kishoreganj","Bajitpur","110257","Sorarchar Islamia Fazil Madrasah","Day","Bangla","General","Co-Edu","1.00","1.00","80"
"Kishoreganj","Bhairab","110284","Aptabul Ulum Alim Madrasah","Day","Bangla","General","Co-Edu","1.00","1.00","70"
"Kishoreganj","Bhairab","110282","Islampur (Kalipur) Mohiul Islam Fazil Madrasah","Day","Bangla","General","Co-Edu","1.00","1.00","90"
"Kishoreganj","Bhairab","110281","Moulovi Keramot Ali Fazil Madrasah","Day","Bangla","General","Co-Edu","1.00","1.00","81"
"Kishoreganj","Bhairab","110283","Samvopur Darussunnat Nesaria Alim Madrasah","Day","Bangla","General","Co-Edu","1.00","1.00","140"
"Kishoreganj","Hossainpur","110313","Dahara Golpukur Sayedunnesa Alim Madrasah","Day","Bangla","Science (Madrasha)","Co-Edu","1.00","0.00","20"
"Kishoreganj","Hossainpur","110313","Dahara Golpukur Sayedunnesa Alim Madrasah","Day","Bangla","General","Co-Edu","1.00","1.00","250"
"Kishoreganj","Hossainpur","110314","Madhkhola Fazil Madrasah","Day","Bangla","General","Co-Edu","1.00","1.00","100"
"Kishoreganj","Hossainpur","110315","Surati Ahmadia Fazil Madrasah","Day","Bangla","General","Co-Edu","1.00","1.00","110"
"Kishoreganj","Itna","110338","Choganga Puran Bazar Fazil Madrasah","Day","Bangla","General","Co-Edu","1.00","1.00","100"
"Kishoreganj","Karimganj","110380","Alhaj Rangukhan Memorial GirlS Alim Madrasah","Day","Bangla","General","Female","1.00","1.00","80"
"Kishoreganj","Karimganj","110369","Jhautala Anowaria Alim Madrasah","Day","Bangla","General","Co-Edu","1.00","1.00","150"
"Kishoreganj","Karimganj","110368","Karimganj Sobhania Fazil Madrasah","Day","Bangla","General","Co-Edu","1.00","1.00","370"
"Kishoreganj","Karimganj","110366","Khaksri Nurul Ulum D. S. Alim Madrasah","Day","Bangla","General","Co-Edu","1.00","1.00","140"
"Kishoreganj","Karimganj","110367","Kiraton Islamia Fazil Madrasah","Day","Bangla","General","Co-Edu","1.00","1.00","130"
"Kishoreganj","Karimganj","110371","Neyamatpur Alim Madrasah","Day","Bangla","General","Co-Edu","1.00","1.00","140"
"Kishoreganj","Katiadi","110414","Fekah Mara Fazil Madrasah","Day","Bangla","General","Co-Edu","1.00","1.00","180"
"Kishoreganj","Katiadi","110430","Gausia Rahmania Hosainia Alim Madrasah","Day","Bangla","General","Co-Edu","1.00","1.00","80"
"Kishoreganj","Katiadi","110418","Shahasram Saimunnesa Alim Madrasah","Day","Bangla","General","Co-Edu","1.00","1.00","100"
"Kishoreganj","Kishoreganj Sadar","110474","Auliapara Fazil Madrasah","Day","Bangla","General","Co-Edu","1.00","1.00","160"
"Kishoreganj","Kishoreganj Sadar","110478","Barabag Emdadul Ulum Alim Madrasah","Day","Bangla","General","Co-Edu","1.00","1.00","110"
"Kishoreganj","Kishoreganj Sadar","110476","Haybatnagar A. U. Kamil Madrasah","Day","Bangla","Muzzabid","Co-Edu","1.00","1.00","20"
"Kishoreganj","Kishoreganj Sadar","110476","Haybatnagar A. U. Kamil Madrasah","Day","Bangla","Science (Madrasha)","Co-Edu","1.00","1.00","60"
"Kishoreganj","Kishoreganj Sadar","110476","Haybatnagar A. U. Kamil Madrasah","Day","Bangla","General","Co-Edu","1.00","1.00","240"
"Kishoreganj","Kishoreganj Sadar","110477","Mathia E. U. Fazil Madrasah","Day","Bangla","General","Co-Edu","1.00","1.00","180"
"Kishoreganj","Kishoreganj Sadar","110479","Nohar Nandala Alim Madrasah","Day","Bangla","General","Co-Edu","1.00","1.00","210"
"Kishoreganj","Kishoreganj Sadar","110472","Nurul Ul. Adarsha Mohila Fazil Madrasah","Day","Bangla","General","Female","1.00","1.00","80"
"Kishoreganj","Kishoreganj Sadar","110472","Nurul Ul. Adarsha Mohila Fazil Madrasah","Day","Bangla","Science (Madrasha)","Female","1.00","1.00","20"
"Kishoreganj","Kuliar Char","131792","Gobria Isharatul Ul. Fazil Madrasah","Day","Bangla","General","Co-Edu","1.00","1.00","90"
"Kishoreganj","Kuliar Char","110511","Salua Fazil Madrasah","Day","Bangla","General","Co-Edu","1.00","1.00","110"
"Kishoreganj","Mithamain","110527","Maisherkandu Nejamia Matlubul Ulum Alim Madrasah","Day","Bangla","General","Co-Edu","1.00","1.00","90"
"Kishoreganj","Pakundia","110596","Barabor Alim Madrasah","Day","Bangla","General","Co-Edu","1.00","1.00","50"
"Kishoreganj","Pakundia","110603","Bartia Alim Madrasah","Day","Bangla","General","Co-Edu","1.00","1.00","50"
"Kishoreganj","Pakundia","110597","Char Kaona Maddhya Para Alim Madrasah","Day","Bangla","General","Co-Edu","1.00","1.00","80"
"Kishoreganj","Pakundia","110590","Eagashindhu Isa Khan Alim Madrasah","Day","Bangla","General","Co-Edu","1.00","1.00","75"
"Kishoreganj","Pakundia","110585","Mangalbaria Kamil Madrasah","Day","Bangla","Science (Madrasha)","Co-Edu","1.00","1.00","70"
"Kishoreganj","Pakundia","110585","Mangalbaria Kamil Madrasah","Day","Bangla","General","Co-Edu","1.00","1.00","200"
"Kishoreganj","Pakundia","110587","Mirdi Fazil Madrasah","Day","Bangla","General","Co-Edu","1.00","1.00","70"
"Kishoreganj","Pakundia","110589","Mirzapur Alim Madrasah","Day","Bangla","General","Co-Edu","1.00","1.00","110"
"Kishoreganj","Pakundia","110584","Nur Hossaini Alim Madrasah","Day","Bangla","General","Co-Edu","1.00","1.00","130"
"Kishoreganj","Pakundia","110588","Pachol Gota Senior Fazil Madrasah","Day","Bangla","General","Co-Edu","1.00","1.00","40"
"Kishoreganj","Pakundia","110595","Shailajani Alim Madrasah","Day","Bangla","General","Co-Edu","1.00","1.00","160"
"Kishoreganj","Pakundia","110586","Tarakandi Fazil Madrasah","Day","Bangla","General","Co-Edu","1.00","1.00","200"
"Kishoreganj","Pakundia","110586","Tarakandi Fazil Madrasah","Day","Bangla","Science (Madrasha)","Co-Edu","1.00","1.00","40"
"Kishoreganj","Tarail","110632","Daudpur Banail Alim Madrasah","Day","Bangla","General","Co-Edu","1.00","1.00","90"
"Kishoreganj","Tarail","110635","Dhala Bahumukhi Alim Madrasah","Day","Bangla","General","Co-Edu","1.00","1.00","60"
"Kishoreganj","Tarail","110633","Kazla Alim Madrasah","Day","Bangla","General","Co-Edu","1.00","1.00","110"
"Kishoreganj","Tarail","110636","Razzakia Darus Sunna Alim Madrasah","Day","Bangla","General","Co-Edu","1.00","1.00","110"
"Kishoreganj","Tarail","110631","Taljanga Union Alim Madrasah","Day","Bangla","General","Co-Edu","1.00","1.00","80"
"Kurigram","Bhurungamari","122106","Baushmari Fazil Madrasah","Day","Bangla","General","Co-Edu","1.00","1.00","70"
"Kurigram","Bhurungamari","122119","Beldah Alim Madrasah","Day","Bangla","General","Co-Edu","1.00","1.00","20"
"Kurigram","Bhurungamari","122105","Bhurungamari Fazil Madrasah","Day","Bangla","General","Co-Edu","1.00","1.00","240"
"Kurigram","Bhurungamari","122105","Bhurungamari Fazil Madrasah","Day","Bangla","Science (Madrasha)","Co-Edu","1.00","1.00","70"
"Kurigram","Bhurungamari","122107","Char Baruitari Alim Madrasah","Day","Bangla","Science (Madrasha)","Co-Edu","1.00","1.00","50"
"Kurigram","Bhurungamari","122107","Char Baruitari Alim Madrasah","Day","Bangla","General","Co-Edu","1.00","1.00","70"
"Kurigram","Char Rajibpur","122140","Char Rajibpur Alim Madrasah","Day","Bangla","General","Co-Edu","1.00","1.00","190"
"Kurigram","Char Rajibpur","122141","Nayachar Islamia Fazil Madrasah","Day","Bangla","General","Co-Edu","1.00","1.00","60"
"Kurigram","Chilmari","122166","Balabari Hat Fazil Madrasah","Day","Bangla","General","Co-Edu","1.00","1.00","30"
"Kurigram","Chilmari","122165","Chilmari Se. Alim Madrasah","Day","Bangla","Science (Madrasha)","Co-Edu","1.00","1.00","40"
"Kurigram","Chilmari","122165","Chilmari Se. Alim Madrasah","Day","Bangla","General","Co-Edu","1.00","1.00","130"
"Kurigram","Chilmari","122168","Fokirer Hat Mofijia Alim Madrasah","Day","Bangla","General","Co-Edu","1.00","1.00","80"
"Kurigram","Chilmari","122167","Rajarvita Islamia Fazil Madrasah","Day","Bangla","General","Co-Edu","1.00","1.00","60"
"Kurigram","Chilmari","122171","Rajarvita Islamia Mahila Alim Madrasah","Day","Bangla","General","Female","1.00","1.00","40"
"Kurigram","Kurigram Sadar","122308","Char Holoo Khana Emdadia Alim Madrasah","Day","Bangla","General","Co-Edu","1.00","1.00","70"
"Kurigram","Kurigram Sadar","122308","Char Holoo Khana Emdadia Alim Madrasah","Day","Bangla","Science (Madrasha)","Co-Edu","1.00","1.00","50"
"Kurigram","Kurigram Sadar","122299","Islampur M. U. Bohumukhi Fazil Madrasah","Day","Bangla","Science (Madrasha)","Co-Edu","1.00","1.00","50"
"Kurigram","Kurigram Sadar","122299","Islampur M. U. Bohumukhi Fazil Madrasah","Day","Bangla","General","Co-Edu","1.00","1.00","120"
"Kurigram","Kurigram Sadar","122303","Kathalbari N. S. Fazil Madrasah","Day","Bangla","Science (Madrasha)","Co-Edu","1.00","1.00","50"
"Kurigram","Kurigram Sadar","122303","Kathalbari N. S. Fazil Madrasah","Day","Bangla","General","Co-Edu","1.00","1.00","100"
"Kurigram","Kurigram Sadar","122302","Kurigram Kamil Madrasah","Day","Bangla","Muzzabid","Co-Edu","1.00","1.00","90"
"Kurigram","Kurigram Sadar","122302","Kurigram Kamil Madrasah","Day","Bangla","Science (Madrasha)","Co-Edu","1.00","1.00","210"
"Kurigram","Kurigram Sadar","122302","Kurigram Kamil Madrasah","Day","Bangla","General","Co-Edu","1.00","1.00","570"
"Kurigram","Nageshwari","122424","Bhitarband Darussunnat Fazil Madrasah","Day","Bangla","General","Co-Edu","1.00","1.00","140"
"Kurigram","Nageshwari","122416","Golerhat Fazil Madrasah","Day","Bangla","Science (Madrasha)","Co-Edu","1.00","1.00","50"
"Kurigram","Nageshwari","122416","Golerhat Fazil Madrasah","Day","Bangla","General","Co-Edu","1.00","1.00","210"
"Kurigram","Nageshwari","122415","Nageswari Kamil Madrasah","Day","Bangla","Science (Madrasha)","Co-Edu","1.00","1.00","80"
"Kurigram","Nageshwari","122415","Nageswari Kamil Madrasah","Day","Bangla","General","Co-Edu","1.00","1.00","240"
"Kurigram","Nageshwari","122419","Neuashi Is. Alim Madrasah","Day","Bangla","General","Co-Edu","1.00","1.00","60"
"Kurigram","Nageshwari","122420","Sonair Khamar Alim Madrasah","Day","Bangla","General","Co-Edu","1.00","1.00","60"
"Kurigram","Nageshwari","122418","West Pairadanga Alim Madrasah","Day","Bangla","General","Co-Edu","1.00","1.00","60"
"Kurigram","Phulbari","122224","Nagarajpur Islamia Alim Madrasah","Day","Bangla","General","Co-Edu","1.00","1.00","70"
"Kurigram","Phulbari","122224","Nagarajpur Islamia Alim Madrasah","Day","Bangla","Science (Madrasha)","Co-Edu","1.00","1.00","90"
"Kurigram","Phulbari","122222","Shahbazar A. H. Fazil Madrasah","Day","Bangla","Science (Madrasha)","Co-Edu","1.00","1.00","100"
"Kurigram","Phulbari","122222","Shahbazar A. H. Fazil Madrasah","Day","Bangla","General","Co-Edu","1.00","1.00","110"
"Kurigram","Rajarhat","122504","Bachhra Azizia Alim Madrasah","Day","Bangla","General","Co-Edu","1.00","1.00","90"
"Kurigram","Rajarhat","122505","Chandamari Fazil Madrasah","Day","Bangla","General","Co-Edu","1.00","1.00","60"
"Kurigram","Rajarhat","122512","Dangrarhat Azizia Alim Madrasah","Day","Bangla","General","Co-Edu","1.00","1.00","70"
"Kurigram","Rajarhat","122507","Rajarhat Fazil Madrasah","Day","Bangla","Science (Madrasha)","Co-Edu","1.00","1.00","70"
"Kurigram","Rajarhat","122507","Rajarhat Fazil Madrasah","Day","Bangla","General","Co-Edu","1.00","1.00","230"
"Kurigram","Rajarhat","122520","Rajmalli Taluar Para Hamidia Alim Madrasah","Day","Bangla","General","Co-Edu","1.00","1.00","70"
"Kurigram","Rajarhat","122506","Rajmallihat Fazil Madrasah","Day","Bangla","General","Co-Edu","1.00","1.00","50"
"Kurigram","Rajarhat","122510","Shukhdeb Fazil Madrasah","Day","Bangla","General","Co-Edu","1.00","1.00","80"
"Kurigram","Raumari","122571","Baraikandi Bazar Darul Ulum Alim Madrasah","Day","Bangla","General","Co-Edu","1.00","1.00","20"
"Kurigram","Raumari","122572","Jadur Char Mohius Sunnah Alim Madrasah","Day","Bangla","General","Co-Edu","1.00","1.00","70"
"Kurigram","Raumari","122564","Roumari Keramatia Adarsha Fazil Madrasah","Day","Bangla","General","Co-Edu","1.00","1.00","250"
"Kurigram","Ulipur","122671","Adarsha Yatimkhana Alim Madrasah","Day","Bangla","Science (Madrasha)","Co-Edu","1.00","1.00","40"
"Kurigram","Ulipur","122671","Adarsha Yatimkhana Alim Madrasah","Day","Bangla","General","Co-Edu","1.00","1.00","100"
"Kurigram","Ulipur","122648","Apuar Khata Nesaria Alim Madrasah","Day","Bangla","General","Co-Edu","1.00","1.00","90"
"Kurigram","Ulipur","122650","Bakerer Hat Fazil Madrasah","Day","Bangla","General","Co-Edu","1.00","1.00","60"
"Kurigram","Ulipur","122653","Balar Char Nasiria Fazil Madrasah","Day","Bangla","General","Co-Edu","1.00","1.00","100"
"Kurigram","Ulipur","122654","Bazra Darul Ul. Fazil Madrasah","Day","Bangla","General","Co-Edu","1.00","1.00","90"
"Kurigram","Ulipur","122645","CHAR KALAKATA GANI MIAH DAKHIL MADRASAH","Day","Bangla","Science (Madrasha)","Co-Edu","1.00","1.00","40"
"Kurigram","Ulipur","122645","CHAR KALAKATA GANI MIAH DAKHIL MADRASAH","Day","Bangla","General","Co-Edu","1.00","1.00","100"
"Kurigram","Ulipur","122666","Dharanibari Latif Rajia Fazil Madrasah","Day","Bangla","Science (Madrasha)","Co-Edu","1.00","1.00","80"
"Kurigram","Ulipur","122666","Dharanibari Latif Rajia Fazil Madrasah","Day","Bangla","General","Co-Edu","1.00","1.00","120"
"Kurigram","Ulipur","122662","Jummahat Darul Ul. Fazil Madrasah","Day","Bangla","General","Co-Edu","1.00","1.00","90"
"Kurigram","Ulipur","122662","Jummahat Darul Ul. Fazil Madrasah","Day","Bangla","Science (Madrasha)","Co-Edu","1.00","1.00","20"
"Kurigram","Ulipur","122651","Kamal Khamar Fazil Madrasah","Day","Bangla","Science (Madrasha)","Co-Edu","1.00","1.00","30"
"Kurigram","Ulipur","122651","Kamal Khamar Fazil Madrasah","Day","Bangla","General","Co-Edu","1.00","1.00","120"
"Kurigram","Ulipur","122652","Karpura Karimia Fazil Madrasah","Day","Bangla","General","Co-Edu","1.00","1.00","100"
"Kurigram","Ulipur","122655","Nureswar Aminia Alim Madrasah","Day","Bangla","General","Co-Edu","1.00","1.00","70"
"Kurigram","Ulipur","122670","Panchpir Keramatia Alim Madrasah","Day","Bangla","General","Co-Edu","1.00","1.00","210"
"Kurigram","Ulipur","122670","Panchpir Keramatia Alim Madrasah","Day","Bangla","Science (Madrasha)","Co-Edu","1.00","1.00","100"
"Kurigram","Ulipur","122685","Sadulla Sarkar Para Mostafabia Alim Madrasah","Day","Bangla","General","Co-Edu","1.00","1.00","50"
"Kurigram","Ulipur","122681","Sat Dargah Girls Alim Madrasah","Day","Bangla","General","Female","1.00","1.00","100"
"Kurigram","Ulipur","122649","Sat Dargah Nesaria Kamil Madrasah","Day","Bangla","General","Co-Edu","1.00","1.00","50"
"Kurigram","Ulipur","122649","Sat Dargah Nesaria Kamil Madrasah","Day","Bangla","Science (Madrasha)","Co-Edu","1.00","1.00","60"
